{
  "$schema": "./schemas/automation-provenance.v2.schema.json",
  "schema_version": 2,
  "generated": {
    "manifest": ".agentic-tooling/generated-manifest.json",
    "accepted_divergences": [
      {
        "path": "private_dot_config/opencode/agents/agent-engineer.md",
        "accepted_digest": "sha256:8b6dce350f9ef1b9a74063579c06dbe226f919895d78359460d2bb4d5e4c845a",
        "required_markers": ["permission:", "source: agents/agent-engineer.yaml"],
        "rationale": "Only permission.task is omitted from generated frontmatter so host and project JSONC own delegation policy."
      },
      {
        "path": "private_dot_config/opencode/agents/special-builder.md",
        "accepted_digest": "sha256:ed4ecb15c106ad79be5ec43a903f917031981d6557379ae22e73fe79c2e7a805",
        "required_markers": ["permission:", "source: agents/special-builder.yaml"],
        "rationale": "Only permission.task is omitted from generated frontmatter so host and project JSONC own delegation policy."
      }
    ]
  },
  "mirrors": {
    "manifest": "configs/devcontainer-sync.jsonc"
  },
  "espanso": {
    "chains": [
      {
        "source": "configs/espanso/aoe-session-name.py",
        "template": ".chezmoitemplates/espanso/aoe-session-name.py.tmpl",
        "renders": [
          "AppData/Roaming/espanso/scripts/aoe-session-name.py.tmpl",
          "private_Library/private_Application Support/espanso/scripts/aoe-session-name.py.tmpl"
        ]
      },
      {
        "source": "configs/espanso/payment-from-copyq.py",
        "template": ".chezmoitemplates/espanso/payment-from-copyq.py.tmpl",
        "renders": [
          "AppData/Roaming/espanso/scripts/payment-from-copyq.py.tmpl",
          "private_Library/private_Application Support/espanso/scripts/payment-from-copyq.py.tmpl"
        ]
      }
    ]
  },
  "statusline": {
    "copies": [
      "dot_claude/executable_statusline.sh",
      "private_Documents/development/container-dotfiles/dotfiles/dot_claude/executable_statusline.sh"
    ],
    "sync_command": ["assets/sync-statusline.sh", "--check"]
  },
  "unslop": {
    "canonical_root": "private_dot_config/opencode/skills/unslop-file/scripts",
    "copies": [
      "dot_claude/skills/unslop-file/scripts",
      "private_Documents/development/container-dotfiles/dotfiles/dot_claude/skills/unslop-file/scripts",
      "private_Documents/development/container-dotfiles/dotfiles/private_dot_config/opencode/skills/unslop-file/scripts"
    ],
    "entrypoints": ["__init__.py", "__main__.py", "cli.py"],
    "snapshot": "docs/unslop-fork-status.md",
    "tree_digest": "sha256:076ffe22199f65e253c013ebffed8049d82531182c0d0c6ec91f9b128c6f19b3"
  },
  "forbidden_behavioral_roots": [".opencode/node_modules/", "archive/"]
}
